<?xml version="1.0" encoding="UTF-8"?>
<coche xmlns:xsi="http://www.w3.org/2001/XMLSchema-instance"
 xsi:noNamespaceSchemaLocation="concesionariooptimizado.xsd" matricula="6732KPC">
    <marca>Seat</marca>
    <modelo>Ateca</modelo>
    <cilindrada>1.7</cilindrada>
    <combustible>Diesel</combustible>
    <precio>23.000€</precio>
    <año>2018</año>
    <color>Negro</color>
    <interesado>33358697A</interesado>
    <interesado>30515455T</interesado>
    <fecha_limite fecha="2022-02-12"/>
    <accesorios>baca llantas navegador</accesorios>
</coche>